{
  "actor": {
    "authority": "tenant-A/write-grant",
    "id": "compliance-officer",
    "tenant_id": "tenant-A",
    "validator_id": "constitutional-council",
    "validator_role": "validator"
  },
  "artifacts": {
    "audit-chain.json": {
      "bytes": 1124,
      "sha256": "52c336eeb3a4531fb93b2a55bdeed1da0c7e4508c6452ac70b99de7e169da08d"
    },
    "decision-receipt.json": {
      "bytes": 1433,
      "sha256": "6866eaab57fafd1e754fa4e281b139f75a583b9129cd3974d6ad2ebc7b642753"
    },
    "replay-report.json": {
      "bytes": 292,
      "sha256": "ab4f317c4bb739dfab44fcb8579ee69076240c9ba0f82f83c5889bdd7458c395"
    },
    "verification-summary.md": {
      "bytes": 5914,
      "sha256": "f98fe39d9a6754aaea7d5fa47426eb69bd7351227dafa9e9ac8356fdbbc86181"
    }
  },
  "audit": {
    "event_count": 1,
    "last_hash": "fc957b9782b6056b9af2baaeb9054a69d80327c45cdd5efc81b5beb35e777ea5"
  },
  "generated_at": "2026-01-01T00:00:00+00:00",
  "generated_with": "acgs proofpack generate (acgs_proofpack_verifier.proofpack)",
  "governed_action": {
    "decision": "allow",
    "declared_goal": "write compliance report",
    "execution_boundary": "local-sandbox",
    "matched_rules": [],
    "proposed_action": "runtime.file.write"
  },
  "how_to_verify": "acgs proofpack verify <pack-dir> [--verifier-key <pubkey>]",
  "policy": {
    "bundle_id": "compliance-ruleset/v1",
    "hash": "ruleset/compliance-ruleset/v1/be02ba386af91111",
    "version": "ruleset/compliance-ruleset/v1/be02ba386af91111"
  },
  "receipt": {
    "audit_event_hash": "fc957b9782b6056b9af2baaeb9054a69d80327c45cdd5efc81b5beb35e777ea5",
    "receipt_hash": "9405c6d62d3b47a375cdf5ab1803500a55260b0379e7d49bb7720eb03a0b93d6",
    "receipt_id": "ev_7d241528aa27483e",
    "request_id": "req-allow",
    "signature_algorithm": "ed25519",
    "signing_key_id": "fixture-key-1"
  },
  "schema_version": "acgs/proof-pack/v1.1"
}
